{
  "$schema": "../../house.schema.json",
  "title": "ADU · Plan B",
  "subtitle": "1 floor · 1,200 sf",
  "units": "ft",
  "plan": {
    "src": "assets/plans/adu-plan-b.png",
    "title": "County of San Diego · Detached ADU, Plan B (1,200 sf) · Sheet A1",
    "bounds": [404, 299, 2000, 1247]
  },
  "floors": [{ "name": "Ground floor", "walkStart": "Living & dining" }],
  "rooms": [
    {
      "name": "Living & dining", "type": "living",
      "pts": [[0, 0], [10.67, 0], [10.67, 12], [21, 12], [21, 32], [0, 32]],
      "desc": "Open living room (20' x 16') and dining room (10'8\" x 9'6\") with the front door, a bar to the kitchen and an arch to the hall.",
      "items": [
        { "item": "dining_table", "id": "table", "at": [5.33, 6] },
        { "item": "vase", "on": "table" },
        { "item": "dining_chair", "around": "table", "count": 4 },
        { "item": "tv_stand", "id": "tv-stand", "wall": "E", "along": 0.45 },
        { "item": "tv", "on": "tv-stand" },
        { "item": "sofa", "id": "sofa", "front": "tv-stand", "gap": 7.2 },
        { "item": "coffee_table", "id": "coffee", "front": "sofa", "gap": 1.3 },
        { "item": "bowl", "on": "coffee" },
        { "item": "rug", "under": ["sofa", "coffee"], "color": "stone" },
        { "item": "armchair", "beside": "coffee", "side": "right", "gap": 3, "face": "coffee" },
        { "item": "floor_lamp", "beside": "sofa", "side": "left", "gap": 0.6 },
        { "item": "bookcase", "wall": "S", "along": 0 },
        { "item": "console_table", "id": "console", "wall": "W", "along": 0.57 },
        { "item": "table_lamp", "on": "console" },
        { "item": "planter", "corner": "NE", "scale": 0.8 },
        { "item": "planter", "corner": "SE" }
      ]
    },
    {
      "name": "Kitchen", "type": "kitchen",
      "pts": [[10.67, 0], [21, 0], [21, 12], [10.67, 12]],
      "desc": "Kitchen (10' x 10'8\") with counter, range and fridge, a 4' pony-wall bar to the dining room, open to the living room.",
      "items": [
        { "item": "counter", "id": "counter", "wall": "N", "along": 0, "w": 6.6 },
        { "item": "fridge", "beside": "counter", "side": "right" },
        { "item": "wall_cabinets", "wall": "N", "w": 2.3 }
      ]
    },
    {
      "name": "Bath", "type": "bath",
      "pts": [[21, 0], [27.25, 0], [27.25, 12], [21, 12]],
      "desc": "Bath (6' x 10'8\") with a roll-in shower, toilet and vanity.",
      "items": [
        { "item": "shower", "corner": "NW" },
        { "item": "toilet", "wall": "N", "along": 0.93 },
        { "item": "sink", "wall": "E", "along": 0.65 },
        { "item": "rug", "at": "center", "w": 2.3, "d": 3.3, "color": "mist" }
      ]
    },
    {
      "name": "Bedroom #1", "type": "bedroom",
      "pts": [[27.25, 0], [37.33, 0], [37.33, 12], [27.25, 12]],
      "desc": "Bedroom #1 (9'8\" x 10'8\") with a queen bed, nightstand, lamp and dresser.",
      "items": [
        { "item": "bed_queen", "id": "bed", "wall": "E", "along": 0.5 },
        { "item": "nightstand", "id": "ns", "beside": "bed", "side": "left" },
        { "item": "table_lamp", "on": "ns" },
        { "item": "dresser", "id": "dresser", "wall": "W", "along": 0.4 },
        { "item": "sculpture", "on": "dresser" },
        { "item": "rug", "under": "bed", "color": "oat" }
      ]
    },
    {
      "name": "Laundry", "type": "laundry",
      "pts": [[37.33, 0], [43, 0], [43, 12], [37.33, 12]],
      "desc": "Laundry with washer/dryer behind bi-fold doors, plus closet storage.",
      "items": [
        { "item": "washer", "id": "washer", "wall": "N", "along": 0 },
        { "item": "washer", "beside": "washer", "side": "right" },
        { "item": "shelf", "wall": "E" }
      ]
    },
    {
      "name": "Hall", "type": "hall",
      "pts": [[21, 12], [43, 12], [43, 16], [21, 16]],
      "desc": "Hall from the living room to the bedrooms, bath and laundry, with the side entry door.",
      "items": [
        { "item": "frames", "wall": "N" },
        { "item": "rug", "at": "center", "w": 10.5, "d": 2, "color": "linen" }
      ]
    },
    {
      "name": "Bedroom #2", "type": "bedroom",
      "pts": [[43, 0], [54, 0], [54, 16], [43, 16]],
      "desc": "Bedroom #2 (10'10\" x 15') with a queen bed, two nightstands, wardrobe and a reading chair.",
      "items": [
        { "item": "bed_queen", "id": "bed", "wall": "E", "along": 0.5 },
        { "item": "nightstand", "id": "ns-left", "beside": "bed", "side": "left" },
        { "item": "table_lamp", "on": "ns-left" },
        { "item": "nightstand", "id": "ns-right", "beside": "bed", "side": "right" },
        { "item": "table_lamp", "on": "ns-right" },
        { "item": "rug", "under": "bed", "color": "green" },
        { "item": "wardrobe", "wall": "W", "along": 0 },
        { "item": "armchair", "wall": "W", "along": 0.5 },
        { "item": "planter", "corner": "SE", "scale": 0.7 }
      ]
    }
  ],
  "openings": [
    { "type": "window", "room": "Living & dining", "wall": "N", "offset": 4, "w": 4 },
    { "type": "window", "room": "Living & dining", "wall": "W", "offset": 4, "w": 4 },
    { "type": "door", "room": "Living & dining", "wall": "W", "offset": 12, "w": 3 },
    { "type": "window", "room": "Living & dining", "wall": "W", "offset": 19, "w": 6 },
    { "type": "window", "room": "Living & dining", "wall": "S", "offset": 4, "w": 2, "sill": 3.6 },
    { "type": "window", "room": "Living & dining", "wall": "S", "offset": 15, "w": 2, "sill": 3.6 },
    { "type": "window", "room": "Living & dining", "wall": "E", "offset": 13, "w": 2, "sill": 3.6 },
    { "type": "pony", "between": ["Living & dining", "Kitchen"], "wall": "E", "w": 9.8 },
    { "type": "pass", "between": ["Living & dining", "Kitchen"], "wall": "N", "w": 9.5, "full": true },
    { "type": "pass", "between": ["Living & dining", "Hall"], "w": 3.3 },

    { "type": "window", "room": "Kitchen", "wall": "N", "offset": 1.8, "w": 3, "sill": 3.8, "head": 5.8 },
    { "type": "window", "room": "Bath", "wall": "N", "offset": 2.5, "w": 3, "sill": 4.6 },
    { "type": "window", "room": "Bedroom #1", "wall": "N", "offset": 2.9, "w": 6 },

    { "type": "door", "between": ["Hall", "Bath"], "offset": 1.7, "w": 2.67 },
    { "type": "door", "between": ["Hall", "Bedroom #1"], "offset": 0.7, "w": 2.67 },
    { "type": "door", "between": ["Hall", "Laundry"], "offset": 1.5, "w": 2.5 },
    { "type": "door", "between": ["Hall", "Bedroom #2"], "w": 2.67 },

    { "type": "door", "room": "Hall", "wall": "S", "offset": 1, "w": 3 },
    { "type": "window", "room": "Hall", "wall": "S", "offset": 4.4, "w": 2, "sill": 3.6 },
    { "type": "window", "room": "Hall", "wall": "S", "offset": 18, "w": 2, "sill": 3.6 },

    { "type": "window", "room": "Bedroom #2", "wall": "N", "offset": 3, "w": 4 },
    { "type": "window", "room": "Bedroom #2", "wall": "S", "offset": 3, "w": 4 }
  ]
}
