{
  "$schema": "../../house.schema.json",
  "title": "Cottage",
  "subtitle": "1 floor · 900 sf",
  "units": "ft",
  "floors": [{ "name": "Ground floor", "walkStart": "Living & kitchen" }],
  "rooms": [
    {
      "name": "Bedroom 2", "type": "bedroom",
      "pts": [[0, 0], [11, 0], [11, 9], [0, 9]],
      "desc": "Second bedroom (11' x 9') with a twin bed, nightstand and a desk.",
      "items": [
        { "item": "bed_twin", "id": "bed", "wall": "S", "along": 0.4 },
        { "item": "nightstand", "id": "ns", "beside": "bed", "side": "right" },
        { "item": "table_lamp", "on": "ns" },
        { "item": "rug", "under": "bed", "color": "mist" },
        { "item": "desk", "id": "desk", "wall": "N", "along": 1 },
        { "item": "office_chair", "front": "desk", "gap": -0.8 }
      ]
    },
    {
      "name": "Laundry", "type": "laundry",
      "pts": [[11, 0], [15, 0], [15, 5], [11, 5]],
      "desc": "Laundry closet (4' x 5') at the end of the hall with a washer.",
      "items": [
        { "item": "washer", "id": "washer", "wall": "N" }
      ]
    },
    {
      "name": "Main bedroom", "type": "bedroom",
      "pts": [[15, 0], [30, 0], [30, 15], [15, 15]],
      "desc": "Main bedroom (15' x 15') with a queen bed, two nightstands with lamps and a dresser.",
      "items": [
        { "item": "bed_queen", "id": "bed", "wall": "S" },
        { "item": "nightstand", "id": "ns-l", "beside": "bed", "side": "left" },
        { "item": "table_lamp", "on": "ns-l" },
        { "item": "nightstand", "id": "ns-r", "beside": "bed", "side": "right" },
        { "item": "table_lamp", "on": "ns-r" },
        { "item": "rug", "under": "bed", "color": "oat" },
        { "item": "dresser", "id": "dresser", "wall": "N", "along": 0.15 },
        { "item": "sculpture", "on": "dresser" },
        { "item": "planter", "corner": "NE", "scale": 0.7 }
      ]
    },
    {
      "name": "Hall", "type": "hall",
      "pts": [[11, 5], [15, 5], [15, 15], [11, 15]],
      "desc": "Hall running north from the living area to the bedrooms, bath and laundry.",
      "items": [
        { "item": "frames", "wall": "E", "along": 1, "scale": 0.6 },
        { "item": "rug", "at": "center", "w": 2.5, "d": 7, "color": "linen" }
      ]
    },
    {
      "name": "Bath", "type": "bath",
      "pts": [[0, 9], [11, 9], [11, 15], [0, 15]],
      "desc": "Bathroom (11' x 6') with a tub, toilet and vanity.",
      "items": [
        { "item": "bathtub", "id": "tub", "wall": "N", "along": 0 },
        { "item": "sink", "wall": "S", "along": 0.3 },
        { "item": "toilet", "wall": "S", "along": 0.65 },
        { "item": "rug", "front": "tub", "gap": 0.1, "w": 3.5, "d": 1.2, "color": "mist" }
      ]
    },
    {
      "name": "Living & kitchen", "type": "living",
      "pts": [[0, 15], [30, 15], [30, 30], [0, 30]],
      "desc": "Open-plan kitchen, dining and living room (30' x 15') with the front door and a sliding door to the deck.",
      "items": [
        { "item": "counter", "id": "counter", "wall": "W", "along": 1, "w": 9 },
        { "item": "fridge", "beside": "counter", "side": "right" },
        { "item": "wall_cabinets", "wall": "W", "offset": 6.1, "w": 3 },
        { "item": "wall_cabinets", "wall": "W", "along": 1, "w": 2.8 },
        { "item": "dining_table", "id": "table", "at": [9.5, 22] },
        { "item": "vase", "on": "table" },
        { "item": "dining_chair", "around": "table", "count": 4 },
        { "item": "tv_stand", "id": "tv-stand", "wall": "N", "offset": 20 },
        { "item": "tv", "on": "tv-stand" },
        { "item": "sofa", "id": "sofa", "front": "tv-stand", "gap": 7 },
        { "item": "coffee_table", "id": "coffee", "front": "sofa", "gap": 1.3 },
        { "item": "bowl", "on": "coffee" },
        { "item": "rug", "under": ["sofa", "coffee"], "color": "stone" },
        { "item": "armchair", "beside": "coffee", "side": "left", "gap": 1.5, "face": "coffee" },
        { "item": "floor_lamp", "beside": "sofa", "side": "right", "gap": 0.5 }
      ]
    },
    {
      "name": "Deck", "type": "outdoor", "outdoor": true,
      "pts": [[30, 18], [40, 18], [40, 28], [30, 28]],
      "desc": "Small east deck (10' x 10') off the living room through a sliding glass door.",
      "items": [
        { "item": "outdoor_lounge", "wall": "N", "along": 1 },
        { "item": "outdoor_table", "id": "otable", "at": [36, 25] },
        { "item": "outdoor_chair", "around": "otable", "count": 2, "rot": 90 }
      ]
    }
  ],
  "openings": [
    { "type": "door", "room": "Living & kitchen", "wall": "S", "offset": 13, "w": 3 },
    { "type": "window", "room": "Living & kitchen", "wall": "S", "offset": 4, "w": 3 },
    { "type": "window", "room": "Living & kitchen", "wall": "S", "offset": 21, "w": 5 },
    { "type": "window", "room": "Living & kitchen", "wall": "W", "offset": 9.5, "w": 2, "sill": 3.6 },
    { "type": "glass", "between": ["Living & kitchen", "Deck"], "w": 6 },
    { "type": "window", "room": "Living & kitchen", "wall": "E", "offset": 0.7, "w": 2 },
    { "type": "pass", "between": ["Living & kitchen", "Hall"], "w": 3.5 },

    { "type": "door", "between": ["Hall", "Bedroom 2"], "w": 2.67 },
    { "type": "door", "between": ["Hall", "Bath"], "w": 2.5 },
    { "type": "door", "between": ["Hall", "Main bedroom"], "w": 2.67 },
    { "type": "door", "between": ["Hall", "Laundry"], "w": 2.5, "swing": "Hall" },

    { "type": "window", "room": "Bedroom 2", "wall": "N", "offset": 2.5, "w": 4 },
    { "type": "window", "room": "Bedroom 2", "wall": "W", "offset": 2.5, "w": 4 },
    { "type": "window", "room": "Bath", "wall": "W", "offset": 2, "w": 2.5, "sill": 4.5 },
    { "type": "window", "room": "Main bedroom", "wall": "N", "offset": 5, "w": 5 },
    { "type": "window", "room": "Main bedroom", "wall": "E", "offset": 5, "w": 5 }
  ]
}
